{
  "$schema": "../../../../knowledge-base-app/config/schema/character-update.schema.json",
  "sessionId": "2026-08-03-queen-flower-sheet-update-test",
  "status": "applied",
  "visibility": "dm-only",
  "updates": [
    {
      "characterId": "character-queen-flower",
      "field": "movement",
      "previousValue": "",
      "proposedValue": "30",
      "evidence": ["uploaded photo page 1, movement box"],
      "confidence": "high",
      "reviewState": "confirmed"
    },
    {
      "characterId": "character-queen-flower",
      "field": "levelRank",
      "previousValue": "",
      "proposedValue": "2",
      "evidence": ["uploaded photo page 1, level/rank box"],
      "confidence": "high",
      "reviewState": "confirmed"
    },
    {
      "characterId": "character-queen-flower",
      "field": "combat.currentHp",
      "previousValue": "",
      "proposedValue": "10",
      "evidence": ["uploaded photo page 1, current HP box"],
      "confidence": "high",
      "reviewState": "confirmed"
    },
    {
      "characterId": "character-queen-flower",
      "field": "combat.armorClass",
      "previousValue": "",
      "proposedValue": "5",
      "evidence": ["uploaded photo page 1, armor class box"],
      "confidence": "high",
      "reviewState": "confirmed"
    },
    {
      "characterId": "character-queen-flower",
      "field": "abilityScores",
      "previousValue": "",
      "proposedValue": {
        "strength": "2",
        "dexterity": "2",
        "constitution": "8",
        "intelligence": "5",
        "wisdom": "7",
        "charisma": "6"
      },
      "evidence": ["uploaded photo page 1, ability score boxes"],
      "confidence": "high",
      "reviewState": "confirmed"
    },
    {
      "characterId": "character-queen-flower",
      "field": "powers.astralProjection.rollCheck",
      "previousValue": "",
      "proposedValue": "passive",
      "evidence": ["uploaded photo page 1 and page 2, astral projection rows"],
      "confidence": "high",
      "reviewState": "confirmed"
    },
    {
      "characterId": "character-queen-flower",
      "field": "powers.astralProjection.usesRange",
      "previousValue": "",
      "proposedValue": "N/A",
      "evidence": ["uploaded photo page 1 and page 2, astral projection rows"],
      "confidence": "high",
      "reviewState": "confirmed"
    },
    {
      "characterId": "character-queen-flower",
      "field": "powers.personalTreasury",
      "previousValue": "50 gold per week",
      "proposedValue": "50 gold per week; roll for taxes: 10d10 gold, 1 time per in-game month",
      "evidence": ["uploaded photo page 1, personal treasury row"],
      "confidence": "high",
      "reviewState": "confirmed"
    },
    {
      "characterId": "character-queen-flower",
      "field": "attacks.astralInfluenceFelt",
      "previousValue": "",
      "proposedValue": "To hit: roll exceeds enemy AC; damage: 1d4 physical effect",
      "evidence": ["uploaded photo page 2, attack row", "user clarification in chat"],
      "confidence": "high",
      "reviewState": "confirmed"
    }
  ]
}
